{
  "type": "object",
  "additionalProperties": false,
  "properties": {
    "schema": {
      "const": "moso.direction-pack/0.1"
    },
    "id": {
      "type": "string",
      "minLength": 1
    },
    "version": {
      "type": "string",
      "minLength": 1
    },
    "title": {
      "type": "string",
      "minLength": 1
    },
    "provenance": {
      "type": "array",
      "items": {
        "type": "string",
        "minLength": 1
      },
      "uniqueItems": true
    },
    "use_when": {
      "type": "array",
      "items": {
        "type": "string",
        "minLength": 1
      },
      "uniqueItems": true
    },
    "avoid_when": {
      "type": "array",
      "items": {
        "type": "string",
        "minLength": 1
      },
      "uniqueItems": true
    },
    "variants": {
      "type": "array",
      "minItems": 1,
      "items": {
        "type": "object",
        "additionalProperties": false,
        "properties": {
          "id": {
            "type": "string",
            "minLength": 1
          },
          "title": {
            "type": "string",
            "minLength": 1
          },
          "medium": {
            "type": "string",
            "minLength": 1
          },
          "composition": {
            "type": "string",
            "minLength": 1
          },
          "color_light": {
            "type": "string",
            "minLength": 1
          },
          "verification": {
            "type": "array",
            "items": {
              "type": "string",
              "minLength": 1
            },
            "uniqueItems": true
          },
          "preview": {
            "enum": [
              "occlusion",
              "address",
              "trace"
            ]
          }
        },
        "required": [
          "id",
          "title",
          "medium",
          "composition",
          "color_light",
          "verification",
          "preview"
        ]
      }
    }
  },
  "required": [
    "schema",
    "id",
    "version",
    "title",
    "provenance",
    "use_when",
    "avoid_when",
    "variants"
  ],
  "$schema": "https://json-schema.org/draft/2020-12/schema",
  "$id": "https://mosocanvas.local/schemas/direction-pack-0.1.json",
  "title": "MoSoCanvas Direction Pack 0.1"
}
